{
  "$schema": "../../ai/component-catalog-extension.schema.json",
  "schemaVersion": 1,
  "package": "@acme/ui",
  "description": "Application-owned components composed with Kerf UI.",
  "entries": [
    {
      "id": "acme-filter-chip",
      "name": "FilterChip",
      "kind": "component",
      "purpose": "A removable application filter displayed inside a search-field workflow.",
      "useWhen": [
        "A saved application filter needs a compact visible label and remove action."
      ],
      "avoidWhen": [
        "The value belongs to SearchField's own controlled token collection."
      ],
      "publicClasses": ["acme-filter-chip"],
      "publicTokens": ["--acme-filter-chip-accent"],
      "uses": ["chip"],
      "source": "src/filter-chip.tsx",
      "styleSources": ["src/filter-chip.css"],
      "demoSource": "ux-demo/demos/filter-chip.tsx",
      "geometry": {
        "margin": "none",
        "border": "self",
        "padding": "self"
      },
      "documentation": "docs/filter-chip.md"
    },
    {
      "id": "acme-inspector",
      "name": "Inspector",
      "kind": "composition",
      "purpose": "An application inspector composed from Kerf panel, content, and value primitives.",
      "useWhen": ["A selected record needs a titled fact-and-action region."],
      "avoidWhen": ["A ValueTable alone expresses the complete interaction."],
      "uses": ["acme-filter-chip", "toolbar", "value-table"],
      "source": "src/inspector.tsx",
      "demoSource": "ux-demo/demos/inspector.tsx",
      "geometry": {
        "margin": "parent",
        "border": "child",
        "padding": "child",
        "notes": [
          "The embedding pane positions the inspector; Toolbar, ValueTable, and action groups retain their own geometry."
        ]
      },
      "documentation": "docs/inspector.md"
    }
  ]
}
